{
  "registryVersion": "ipl-identities-v1",
  "schemaVersion": "1.0.0",
  "sourceArchiveManifestHash": "c61f75f3facac0f72e126fd611cdf6afed7da875d628ae62338cba1d5380cbf7",
  "venues": [
    {
      "activeSeasonIds": [
        "ipl-2014",
        "ipl-2020",
        "ipl-2021"
      ],
      "canonicalCity": "Abu Dhabi",
      "canonicalName": "Zayed Cricket Stadium",
      "country": "United Arab Emirates",
      "notes": [
        "Reviewed source naming variants of the same Abu Dhabi facility."
      ],
      "relationships": [],
      "reviewStatus": "approved",
      "sourceAliases": [
        {
          "hasMissingCityObservations": false,
          "observedCities": [
            "Abu Dhabi"
          ],
          "seasonIds": [
            "ipl-2014",
            "ipl-2020"
          ],
          "sourceMatchIds": [
            "729279",
            "729283",
            "729285",
            "729293",
            "729305",
            "729307",
            "729315",
            "1216492",
            "1216494",
            "1216497",
            "1216499",
            "1216501",
            "1216503",
            "1216505",
            "1216506",
            "1216508",
            "1216511",
            "1216512",
            "1216514",
            "1216523",
            "1216526",
            "1216529",
            "1216532",
            "1216533",
            "1216537",
            "1216541",
            "1216545",
            "1237178",
            "1237180"
          ],
          "sourcePaths": [
            "729279.json",
            "729283.json",
            "729285.json",
            "729293.json",
            "729305.json",
            "729307.json",
            "729315.json",
            "1216492.json",
            "1216494.json",
            "1216497.json",
            "1216499.json",
            "1216501.json",
            "1216503.json",
            "1216505.json",
            "1216506.json",
            "1216508.json",
            "1216511.json",
            "1216512.json",
            "1216514.json",
            "1216523.json",
            "1216526.json",
            "1216529.json",
            "1216532.json",
            "1216533.json",
            "1216537.json",
            "1216541.json",
            "1216545.json",
            "1237178.json",
            "1237180.json"
          ],
          "sourceVenue": "Sheikh Zayed Stadium"
        },
        {
          "hasMissingCityObservations": false,
          "observedCities": [
            "Abu Dhabi"
          ],
          "seasonIds": [
            "ipl-2021"
          ],
          "sourceMatchIds": [
            "1254087",
            "1254088",
            "1254089",
            "1254095",
            "1254096",
            "1254097",
            "1254098",
            "1254099"
          ],
          "sourcePaths": [
            "1254087.json",
            "1254088.json",
            "1254089.json",
            "1254095.json",
            "1254096.json",
            "1254097.json",
            "1254098.json",
            "1254099.json"
          ],
          "sourceVenue": "Zayed Cricket Stadium, Abu Dhabi"
        }
      ],
      "sourceMatchIds": [
        "729279",
        "729283",
        "729285",
        "729293",
        "729305",
        "729307",
        "729315",
        "1216492",
        "1216494",
        "1216497",
        "1216499",
        "1216501",
        "1216503",
        "1216505",
        "1216506",
        "1216508",
        "1216511",
        "1216512",
        "1216514",
        "1216523",
        "1216526",
        "1216529",
        "1216532",
        "1216533",
        "1216537",
        "1216541",
        "1216545",
        "1237178",
        "1237180",
        "1254087",
        "1254088",
        "1254089",
        "1254095",
        "1254096",
        "1254097",
        "1254098",
        "1254099"
      ],
      "status": "canonical",
      "venueId": "venue-abu-dhabi-zayed",
      "venueSiteId": "venue-site-abu-dhabi-zayed"
    },
    {
      "activeSeasonIds": [
        "ipl-2021",
        "ipl-2022",
        "ipl-2023",
        "ipl-2024",
        "ipl-2025",
        "ipl-2026"
      ],
      "canonicalCity": "Ahmedabad",
      "canonicalName": "Narendra Modi Stadium",
      "country": "India",
      "notes": [
        "Distinct rebuilt venue version at the Motera site."
      ],
      "relationships": [
        {
          "relatedVenueId": "venue-ahmedabad-motera-old",
          "relationshipType": "rebuilt_from"
        }
      ],
      "reviewStatus": "approved",
      "sourceAliases": [
        {
          "hasMissingCityObservations": false,
          "observedCities": [
            "Ahmedabad"
          ],
          "seasonIds": [
            "ipl-2021",
            "ipl-2022",
            "ipl-2023",
            "ipl-2024",
            "ipl-2025",
            "ipl-2026"
          ],
          "sourceMatchIds": [
            "1254078",
            "1254079",
            "1254082",
            "1254083",
            "1254086",
            "1312199",
            "1312200",
            "1359475",
            "1359487",
            "1359497",
            "1359509",
            "1359518",
            "1359525",
            "1359536",
            "1370352",
            "1370353",
            "1422123",
            "1422130",
            "1422135",
            "1426270",
            "1426283",
            "1426297",
            "1426309",
            "1426310",
            "1473442",
            "1473446",
            "1473460",
            "1473472",
            "1473488",
            "1473502",
            "1473504",
            "1473510",
            "1473511",
            "1527682",
            "1529268",
            "1529273",
            "1529285",
            "1529289",
            "1529299",
            "1529309",
            "1535465"
          ],
          "sourcePaths": [
            "1254078.json",
            "1254079.json",
            "1254082.json",
            "1254083.json",
            "1254086.json",
            "1312199.json",
            "1312200.json",
            "1359475.json",
            "1359487.json",
            "1359497.json",
            "1359509.json",
            "1359518.json",
            "1359525.json",
            "1359536.json",
            "1370352.json",
            "1370353.json",
            "1422123.json",
            "1422130.json",
            "1422135.json",
            "1426270.json",
            "1426283.json",
            "1426297.json",
            "1426309.json",
            "1426310.json",
            "1473442.json",
            "1473446.json",
            "1473460.json",
            "1473472.json",
            "1473488.json",
            "1473502.json",
            "1473504.json",
            "1473510.json",
            "1473511.json",
            "1527682.json",
            "1529268.json",
            "1529273.json",
            "1529285.json",
            "1529289.json",
            "1529299.json",
            "1529309.json",
            "1535465.json"
          ],
          "sourceVenue": "Narendra Modi Stadium, Ahmedabad"
        }
      ],
      "sourceMatchIds": [
        "1254078",
        "1254079",
        "1254082",
        "1254083",
        "1254086",
        "1312199",
        "1312200",
        "1359475",
        "1359487",
        "1359497",
        "1359509",
        "1359518",
        "1359525",
        "1359536",
        "1370352",
        "1370353",
        "1422123",
        "1422130",
        "1422135",
        "1426270",
        "1426283",
        "1426297",
        "1426309",
        "1426310",
        "1473442",
        "1473446",
        "1473460",
        "1473472",
        "1473488",
        "1473502",
        "1473504",
        "1473510",
        "1473511",
        "1527682",
        "1529268",
        "1529273",
        "1529285",
        "1529289",
        "1529299",
        "1529309",
        "1535465"
      ],
      "status": "canonical",
      "venueId": "venue-ahmedabad-motera-new",
      "venueSiteId": "venue-site-ahmedabad-motera"
    },
    {
      "activeSeasonIds": [
        "ipl-2010",
        "ipl-2014",
        "ipl-2015"
      ],
      "canonicalCity": "Ahmedabad",
      "canonicalName": "Sardar Patel Stadium, Motera",
      "country": "India",
      "notes": [
        "Retained as a distinct venue version because the former structure was rebuilt."
      ],
      "relationships": [
        {
          "relatedVenueId": "venue-ahmedabad-motera-new",
          "relationshipType": "rebuilt_as"
        }
      ],
      "reviewStatus": "approved",
      "sourceAliases": [
        {
          "hasMissingCityObservations": false,
          "observedCities": [
            "Ahmedabad"
          ],
          "seasonIds": [
            "ipl-2010",
            "ipl-2014",
            "ipl-2015"
          ],
          "sourceMatchIds": [
            "419111",
            "419118",
            "419126",
            "419129",
            "733979",
            "733989",
            "734011",
            "734017",
            "829721",
            "829735",
            "829741",
            "829749"
          ],
          "sourcePaths": [
            "419111.json",
            "419118.json",
            "419126.json",
            "419129.json",
            "733979.json",
            "733989.json",
            "734011.json",
            "734017.json",
            "829721.json",
            "829735.json",
            "829741.json",
            "829749.json"
          ],
          "sourceVenue": "Sardar Patel Stadium, Motera"
        }
      ],
      "sourceMatchIds": [
        "419111",
        "419118",
        "419126",
        "419129",
        "733979",
        "733989",
        "734011",
        "734017",
        "829721",
        "829735",
        "829741",
        "829749"
      ],
      "status": "canonical",
      "venueId": "venue-ahmedabad-motera-old",
      "venueSiteId": "venue-site-ahmedabad-motera"